Artist,Lyrics
lady-gaga,"But I'm still in love with Judas baby Whoa whoa I'm in love with Juda-as, Juda-as Whoa whoa I'm in love with Juda-as, Juda-as Juda-as! Juda-ah-as! Judas! Juda-ah-as Juda-as! Juda-ah-as! Judas! Ga-ah ga-ah I couldn't love a man so purely Even darkness forgave his goofy way I've learned love is like a brick you can Build a house or sink a dead body Ah oh I'll bring him down, bring him down, down Ah oh a king with no crown, king with no crown I'm just a holy fool, oh baby it's so cruel But I'm still in love with Judas, baby I'm just a holy fool, oh baby it's so cruel But I'm still in love with Judas, baby Whoa whoa I'm in love with Juda-as, Juda-as Whoa whoa I'm in love with Juda-as, Juda-as In the most Biblical sense, I am beyond repentance Fame hooker, prostitute wench, vomits her mind But in the cultural sense I just speak in future tense Judas kiss me if offenced, Or wear an ear condom next time I wanna love you, but something's pulling me away from you Jesus is my virtue and Judas is the demon I cling to I cling to Just a holy fool, oh baby he's so cruel"
lady-gaga,"But I'm still in love with Judas, baby I'm just a holy fool, oh baby it's so cruel But I'm still in love with Judas, baby Whoa whoa I'm in love with Juda-as, Juda-as Whoa whoa I'm in love with Juda-as, Juda-as Juda-as! Juda-ah-as! Judas! Juda-ah-as Juda-as! Juda-ah-as! Judas! Ga-ah ga-ah You tell me it gets better, it gets better in time You say I'll pull myself together, pull it together You'll be fine Tell me what the hell do you know What do you know Tell me how the hell could you know How could you know 'Til it happens to you, you don't know How it feels How it feels 'Til it happens to you, you won't know It won't be real No it won't be real Won't know how it feels You tell me hold your head up Hold your head up and be strong 'Cause when you fall, you gotta get up"
lady-gaga,"You gotta get up and move on Tell me, how the hell could you talk How could you talk? 'Cause until you walk where I walk It's just all talk 'Til it happens to you, you don't know How it feels How it feels 'Til it happens to you, you won't know It won't be real (how could you know?) No it won't be real (how could you know?) Won't know how I feel 'Til your world burns and crashes 'Til you're at the end, the end of your rope 'Til you're standing in my shoes, I don't wanna hear nothing from you From you, from you, 'cause you don't know 'Til it happens to you, you don't know How I feel How I feel How I feel 'Til it happens to you, you won't know It won't be real (how could you know?) No it won't be real (how could you know?) Won't know how it feels 'Til it happens to you, happens to you"
lady-gaga,"Happens to you Happens to you, happens to you Happens to you (how could you know?) 'Til it happens to you, you won't know how I feel I stand here waiting for you to bang the gong To crash the critics saying, ""is it right or is it wrong?"" If only fame had an IV, baby could I bear Being away from you, I found the vein, put it in here I live for the applause, applause, applause I live for the applause-plause, live for the applause-plause Live for the way that you cheer and scream for me The applause, applause, applause Give me that thing that I love (Turn the lights on) Put your hands up, make 'em touch, touch (Make it real loud) Give me that thing that I love (Turn the lights on) Put your hands up, make 'em touch, touch (Make it real loud) (A-P-P-L-A-U-S-E) Make it real loud Put your hands up, make 'em touch, touch (A-P-P-L-A-U-S-E) Make it real loud Put your hands up, make 'em touch, touch I've overheard your theory ""Nostalgia's for geeks"" I guess sir, if you say so Some of us just like to read One second I'm a kunst Then suddenly the kunst is me Pop culture was in art"
lady-gaga,"Now, art's in pop culture in me I live for the applause, applause, applause I live for the applause-plause, live for the applause-plause Live for the way that you cheer and scream for me The applause, applause, applause Give me that thing that I love (Turn the lights on) Put your hands up, make 'em touch, touch (Make it real loud) Give me that thing that I love (Turn the lights on) Put your hands up, make 'em touch, touch (Make it real loud) (A-P-P-L-A-U-S-E) Make it real loud Put your hands up, make 'em touch, touch (A-P-P-L-A-U-S-E) Make it real loud Put your hands up, make 'em touch, touch Ooh touch, touch ooh Touch, touch now ooh ooh ooh ooh I live for the applause, applause, applause I live for the applause-plause, live for the applause-plause Live for the way that you cheer and scream for me The applause, applause, applause Give me that thing that I love (Turn the lights on) Put your hands up, make 'em touch, touch (Make it real loud) Give me that thing that I love (Turn the lights on) Put your hands up, make 'em touch, touch (Make it real loud) (A-P-P-L-A-U-S-E) Make it real loud Put your hands up, make 'em touch, touch (Make it real loud) (A-P-P-L-A-U-S-E) Make it real loud Put your hands up, make 'em touch, touch A-R-T-P-O-P [Verse 1]"
lady-gaga,"(Last night) Our lovers quarrel (I was thinking about you) Hurts more than I can say (And it was kind of dirty) Oh my (And the way that you looked at me) Help me here! (It was kind of nasty, aah!) Help me here! (It was kind of trashy) Cause I can't help my mind from going there! [Pre-Chorus] Heard your boyfriend was away this weekend Wanna meet at my place? Heard that we both got nothing to do... When I lay in bed, I touch myself and think of you [Chorus] Last night Damn, you were in my sex dreams (you were in my) Doing really nasty things (you were in my) Damn, you were in my sex dreams (don't stop the party) Making love in my sex dreams (4x) [Verse 2] We could be caught (I just want this to be perfect) We're both convicted criminals of thought (cause I'm broken) Let's white- (by the one before) glove the bed (He was kind of nasty) Help me here!"
lady-gaga,"(And I feel so trashy) Cause we can't hide the evidence in our heads! [Pre-Chorus] Heard your boyfriend was away this weekend Wanna meet at my place? Heard that we both got nothing to do... When I lay in bed, I touch myself and think of you [Chorus 2] Last night Damn, you were in my Sexxx dreams (You were in my) Doing really nasty things (You were in my dreams) Damn, you were in my Sexxx dreams (you were in my) Making love in my Sexxx dreams Don't stop the party (Making love in my Sexxx dreams) Let's keep it naughty (Making love in my Sexxx dreams) Watch me act a fool (Making love in my Sexxx dreams) Tomorrow when I run into you, Tomorrow when I run into you [Bridge] You could turn a stone Or the color of a man petrified by a woman In love as I am when I lay with you I think of him, I think of him [Speaking] I can't believe I'm telling you this, but I've had a couple drinks"
lady-gaga,"And oh my god (*vomits and giggles*) [Chorus 3] Last night Damn, you were in my Sexxx dreams (You were in my) Doing really nasty things (You were in my dreams) Damn, you were in my Sexxx dreams (you were in my) Last night Don't stop the party (Damn, you were in my Sexxx dreams) Let's keep it naughty (Doing really nasty things) Watch me act a fool (Damn, you were in my Sexxx dreams) Tomorrow when I run into you (Making love in my Sexxx dreams) [iTunes Festival Bridge] We were in the swimming pool. I was naked, so were you, and I wrote this song while we made love Dangerous poetry rhymed with our bodies and now's the time for the trial with doubts and drawls (I can't believe I'm telling you this, but I've had a couple of drinks and, oh my god-- [laughs]) Let's have some fun, this beat is sick I wanna take a ride on your disco stick Let's have some fun, this beat is sick I wanna take a ride on your disco stick I wanna kiss you But if I do then I might miss you, babe It's complicated and stupid Got my ass squeezed by sexy Cupid"
lady-gaga,"Guess he wants to play, wants to play A love game, a love game Hold me and love me Just wanna touch you for a minute Baby three seconds isn't enough For my heart to quit it Let's have some fun, this beat is sick I wanna take a ride on your disco stick Don't think too much just bust that kick I wanna take a ride on your disco stick Let's play a love game, play a love game Do you want love or you want fame? Are you in the game? Doin' the love game Let's play a love game, play a love game Do you want love or you want fame? Are you in the game? Doin' the love game I'm on a mission And it involves some heavy touching, yeah You've indicated your interest, I'm educated in sex, yes And now I want it bad, want it bad A love game, a love game Hold me and love me Just want touch you for a minute Baby three seconds isn't enough"
lady-gaga,"For my heart to quit it Let's have some fun, this beat is sick I wanna take a ride on your disco stick Don't think too much just bust that kick I wanna take a ride on your disco stick Let's play a love game, play a love game Do you want love or you want fame? Are you in the game? Doin' the love game Let's play a love game, play a love game Do you want love or you want fame? Are you in the game? Doin' the love game I can see you staring there from across the block With a smile on your mouth and your hand on your huh! The story of us, it always starts the same With a boy and a girl and a huh and a game And a game, and a game, and a game, a love game Let's play a love game, play a love game Do you want love or you want fame? Are you in the game? Doin' the love game Let's play a love game, play a love game Do you want love or you want fame? Are you in the game? Doin' the love game Let's play a love game, play a love game"
lady-gaga,"Do you want love or you want fame? Are you in the game? (Let's have some fun, this beat is sick) Doin' the love game (I wanna take a ride on your disco stick) Let's play a love game, play a love game Do you want love or you want fame? Are you in the game? (Don't think too much just bust that kick) Doin' the love game (I wanna take a ride on your disco stick) Doin' the love game I'm gonna marry the night I won't give up on my life I'm a warrior queen Live passionately tonight I'm gonna marry the dark Gonna make love to the stark I'm a soldier to my own emptiness I am a winner I'm gonna marry the night I'm gonna marry the night I'm gonna marry the night I'm gonna marry the night I'm not gonna cry anymore"
lady-gaga,I'm gonna marry the night Leave nothing on these streets to explore M-m-m-marry m-m-m-marry m-m-m-marry the night Oh m-m-marry m-m-m-marry m-m-m-marry the night I'm gonna lace up my boots Throw on some leather and cruise Down the street that I love In my fishnet gloves I'm a sinner Then I'll go down to the bar But I won't cry anymore I hold my whiskey up high Kiss the bartender twice I'm a loser I'm gonna marry the night I'm gonna marry the night I'm gonna marry the night I'm not gonna cry anymore I'm gonna marry the night Leave nothing on these streets to explore M-m-m-marry m-m-m-marry m-m-m-marry the night Oh m-m-marry m-m-m-marry m-m-m-marry the night Nothing's too cool To take me from you New York is not just a tan
lady-gaga,"That you'll never loose Love is the new Denim or black Skeleton guns Or wedding bells in the attic Get Ginger ready Climb the El Camino front Won't poke holes in the seats with my heels 'Cause that's where we make love Come on and run Turn the car on and run I'm gonna marry the night I'm gonna burn a hole in the road I'm gonna marry the night Leave nothin' on these streets to explode M-m-m-marry m-m-m-marry m-m-m-marry the night Oh m-m-marry m-m-m-marry m-m-m-marry the night Oh m-m-marry m-m-m-marry m-m-m-marry the night I'm gonna marry, marry I'm gonna marry, marry Come on, come on The night, the night, the night The night, the night, the night The night, the night, the night The night, the night, the night The night, the night I wanna hold 'em like they do in Texas plays"
lady-gaga,"Fold 'em, let 'em, hit me, raise it baby stay with me (I love it) Love Game intuition play the cards with spades to start And after he's been hooked I'll play the one that's on his heart Oh, oh, oh, oh, oh, oh-oh-e-oh-oh-oh I'll get him hot, show him what I've got"
lin-manuel-miranda,"How does a bastard, orphan, son of a whore And a Scotsman, dropped in the middle of a forgotten spot in the Caribbean by providence impoverished, In squalor, grow up to be a hero and a scholar? The ten-dollar founding father without a father Got a lot farther by working a lot harder By being a lot smarter By being a self-starter By fourteen, they placed him in charge of a trading charter And every day while slaves were being slaughtered and carted away Across the waves, he struggled and kept his guard up Inside, he was longing for something to be a part of The brother was ready to beg, steal, borrow, or barter Then a hurricane came, and devastation reigned Our man saw his future drip, dripping down the drain Put a pencil to his temple, connected it to his brain And he wrote his first refrain, a testament to his pain Well, the word got around, they said, this kid is insane, man Took up a collection just to send him to the mainland Get your education, don't forget from whence you came And the world is gonna know your name What's your name, man? Alexander Hamilton My name is Alexander Hamilton And there's a million things I haven't done But just you wait, just you wait When he was ten his father split, full of it, debt-ridden Two years later, see Alex and his mother bed-ridden"
lin-manuel-miranda,"Half-dead sittin' in their own sick, the scent thick And Alex got better but his mother went quick Moved in with a cousin, the cousin committed suicide Left him with nothin' but ruined pride, something new inside voice saying Alex, you gotta fend for yourself He started retreatin' and readin' every treatise on the shelf There would have been nothin' left to do for someone less astute He woulda been dead or destitute without a cent of restitution Started workin', clerkin' for his late mother's landlord Tradin' sugar cane and rum and all the things he can't afford Scammin' for every book he can get his hands on Plannin' for the future see him now as he stands on the bow of a ship headed for a new land In New York you can be a new man In New York you can be a new man In New York you can be a new man In New York you can be a new man In New York you can be a new man Just you wait Alexander Hamilton We are waiting in the wings for you You could never back down You never learned to take your time Oh, Alexander Hamilton When America sings for you Will they know what you overcame? Will they know you rewrote your game? The world will never be the same, oh The ship is in the harbor now See if you can spot him Another immigrant comin' up from the bottom His enemies destroyed his rep America forgot him We fought with him Me, I died for him Me, I trusted him Me, I loved him And me, I'm the damn fool that shot him There's a million things I haven't done But just you wait What's your name, man? Alexander Hamilton One, two, three, four, five, six, seven, eight, nine It's the Ten Duel Commandments It's the Ten Duel Commandments Number one The challenge, demand satisfaction If they apologize, no need for further action Number two If they don't, grab a friend, that's your second Your lieutenant when there's reckoning to be reckoned Number three Have your seconds meet face to face Negotiate a peace Or negotiate a time and place This is commonplace, 'specially 'tween recruits Most disputes die, and no one shoots"
lin-manuel-miranda,"Number four If they don't reach a peace, that's alright Time to get some pistols and a doctor on site You pay him in advance, you treat him with civility You have him turn around so he can have deniability Five Duel before the sun is in the sky Pick a place to die where it's high and dry Number six Leave a note for your next of kin Tell 'em where you been Pray that hell or heaven lets you in Seven Confess your sins Ready for the moment of adrenaline when you finally face your opponent Number eight Your last chance to negotiate Send in your seconds, see if they can set the record straight Alexander Aaron Burr, sir Can we agree that duels are dumb and immature? Sure But your man has to answer for his words, Burr With his life? We both know that's absurd, sir Hang on, how many men died because Lee was inexperienced and ruinous? Okay, so we're doin' this Number nine Look 'em in the eye, aim no higher Summon all the courage you require Then count One two three four Five six seven eight nine Number Ten paces Fire How does a ragtag volunteer army in need of a shower Somehow defeat a global superpower? How do we emerge victorious from the quagmire? Leave the battlefield waving Betsy Ross' flag higher? Yo Turns out we have a secret weapon An immigrant you know and love who's unafraid to step in He's constantly confusin', confoundin' the British henchmen Ev'ryone give it up for America's favorite fighting Frenchman Lafayette I'm takin this horse by the reins makin' Redcoats redder with bloodstains Lafayette And I'm never gonna stop until I make 'em"
lin-manuel-miranda,"Drop and burn 'em up and scatter their remains, I'm Lafayette Watch me engagin' em, escapin' em Enragin' em I'm Lafayette I go to France for more funds Lafayette I come back with more Guns And ships And so the balance shifts We rendezvous with Rochambeau, consolidate their gifts We can end this war at Yorktown, cut them off at sea, but For this to succeed, there's someone else we need I know Hamilton Sir, he knows what to do in a trench Ingenuitive and fluent in French, I mean Hamilton Sir, you're gonna have to use him eventually What's he gonna do on the bench? I mean Hamilton No one has more resilience Or matches my practical tactical brilliance Hamilton You wanna fight for your land back? (Hamilton) I need my right hand man back (Hamilton) Ah, uh, get ya right hand man back (Hamilton) You know you gotta get ya right hand man back (Hamilton) I mean you gotta put some thought into the letter but the sooner the better To get your right hand man back Alexander Hamilton Troops are waiting in the field for you If you join us right now, together we can turn the tide Oh, Alexander Hamilton I have soldiers who will yield for you If we manage to get this right They'll surrender by early light The world will never be the same, Alexander I am not throwing away my shot I am not throwing away my shot"
lin-manuel-miranda,"Hey yo, I'm just like my country I'm young, scrappy and hungry And I'm not throwing away my shot I'm 'a get a scholarship to King's College I prob'ly shouldn't brag, but dag, I amaze and astonish The problem is I got a lot of brains but no polish I gotta holler just to be heard With every word, I drop knowledge I'm a diamond in the rough, a shiny piece of coal Tryin' to reach my goal my power of speech, unimpeachable Only nineteen but my mind is older These New York City streets get colder, I shoulder Every burden, every disadvantage I have learned to manage, I don't have a gun to brandish I walk these streets famished The plan is to fan this spark into a flame But damn, it's getting dark, so let me spell out the name I am the A-L-E-X-A-N-D-E-R we are meant to be A colony that runs independently Meanwhile, Britain keeps shittin' on us endlessly Essentially, they tax us relentlessly"
lin-manuel-miranda,"Then King George turns around, runs a spending spree He ain't ever gonna set his descendants free So there will be a revolution in this century Enter me, he says in parentheses Don't be shocked when your hist'ry book mentions me I will lay down my life if it sets us free Eventually, you'll see my ascendancy And I am not throwing away my shot I am not throwing away my shot Hey yo, I'm just like my country I'm young, scrappy and hungry And I'm not throwing away my shot I am not throwing away my shot I am not throwing away my shot Hey yo, I'm just like my country I'm young, scrappy and hungry And I'm not throwing away my shot It's time to take a shot I dream of life without a monarchy The unrest in France will lead to onarchy? Onarchy how you say, how you say, anarchy? When I fight, I make the other side panicky With my, shot Yo, I'm a tailor's apprentice And I got y'all knuckleheads in loco parentis"
lin-manuel-miranda,"I'm joining the rebellion 'cause I know it's my chance To socially advance, instead of sewin' some pants I'm gonna take a shot But we'll never be truly free Until those in bondage have the same rights as you and me You and I. Do or die. Wait till I sally in On a stallion with the first black battalion Have another shot Geniuses, lower your voices You keep out of trouble and you double your choices I'm with you, but the situation is fraught You've got to be carefully taught If you talk, you're gonna get shot Burr, check what we got Mister Lafayette, hard rock like Lancelot I think your pants look hot Laurens, I like you a lot Let's hatch a plot blacker than the kettle callin' the pot What are the odds the gods would put us all in one spot Poppin' a squat on conventional wisdom, like it or not A bunch of revolutionary manumission abolitionists? Give me a position, show me where the ammunition is Oh, am I talkin' too loud? Sometimes I get over excited, shoot off at the mouth"
lin-manuel-miranda,"I never had a group of friends before I promise that I'll make y'all proud Let's get this guy in front of a crowd I am not throwing away my shot I am not throwing away my shot Hey yo, I'm just like my country I'm young, scrappy and hungry And I'm not throwing away my shot I am not throwing away my shot I am not throwing away my shot Hey yo, I'm just like my country I'm young, scrappy and hungry And I'm not throwing away my shot Everybody sing Whoa, whoa, whoa Hey, whoa, whoa, whoa Ay, let 'em hear ya Let's go Whoa, whoa, whoa I said shout it to the rooftops Whoa, whoa, whoa said, to the rooftops Whoa, whoa, whoa come on Come on, let's go Rise up When you're living on your knees, you rise up Tell your brother that he's gotta rise up Tell your sister that she's gotta rise up When are these colonies gonna rise up? When are these colonies gonna rise up?"
lin-manuel-miranda,"When are these colonies gonna rise up? When are these colonies gonna rise up? Rise up I imagine death so much it feels more like a memory When's it gonna get me? In my sleep, seven feet ahead of me? If I see it comin', do I run or do I let it be? Is it like a beat without a melody? See, I never thought I'd live past twenty Where I come from some get half as many Ask anybody why we livin' fast and we laugh, reach for a flask We have to make this moment last, that's plenty Scratch that this is not a moment, it's the movement Where all the hungriest brothers with something to prove went? Foes oppose us, we take an honest stand We roll like Moses, claimin' our promised land And? If we win our independence? 'Zat a guarantee of freedom for our descendants? Or will the blood we shed begin an endless cycle of vengeance and death with no defendants? I know the action in the street is excitin' But Jesus, between all the bleedin' 'n fightin' I've been readin' 'n writin'"
lin-manuel-miranda,"We need to handle our financial situation Are we a nation of states what's the state of our nation? I'm past patiently waitin' I'm passionatelymashin' every expectation Every action's an act of creation I'm laughin' in the face of casualties and sorrow For the first time, I'm thinkin' past tomorrow And I am not throwing away my shot I am not throwing away my shot Hey yo, I'm just like my country I'm young, scrappy and hungry And I'm not throwing away my shot We're gonna rise up (time to take a shot) We're gonna rise up (time to take a shot) We're gonna, rise up, rise up It's time to take a shot Rise up, rise up, it's time to take a shot Rise up, it's time to take a shot Rise up, take a shot, shot, shot It's time to take a shot, time to take a shot And I am not throwing away my shot Not throwing away my shot How does a bastard, orphan, son of a whore And a Scotsman, dropped in the middle of a forgotten spot in the Caribbean by providence impoverished, In squalor, grow up to be a hero and a scholar? The ten-dollar founding father without a father"
lin-manuel-miranda,"Got a lot farther by working a lot harder By being a lot smarter By being a self-starter By fourteen, they placed him in charge of a trading charter And every day while slaves were being slaughtered and carted away Across the waves, he struggled and kept his guard up Inside, he was longing for something to be a part of The brother was ready to beg, steal, borrow, or barter Then a hurricane came, and devastation reigned Our man saw his future drip, dripping down the drain Put a pencil to his temple, connected it to his brain And he wrote his first refrain, a testament to his pain Well, the word got around, they said, this kid is insane, man Took up a collection just to send him to the mainland Get your education, don't forget from whence you came And the world is gonna know your name What's your name, man? Alexander Hamilton My name is Alexander Hamilton And there's a million things I haven't done But just you wait, just you wait When he was ten his father split, full of it, debt-ridden Two years later, see Alex and his mother bed-ridden Half-dead sittin' in their own sick, the scent thick And Alex got better but his mother went quick Moved in with a cousin, the cousin committed suicide Left him with nothin' but ruined pride, something new inside voice saying Alex, you gotta fend for yourself He started retreatin' and readin' every treatise on the shelf There would have been nothin' left to do for someone less astute"
