Artist,Lyrics
michael-jackson,Midnight is so near Please don't disappear Now that you are here Stay awhile
nirvana,"Load up on guns, bring your friends It's fun to lose and to pretend She's over-bored and self-assured Oh no, I know a dirty word Hello, hello, hello, how low Hello, hello, hello, how low Hello, hello, hello, how low Hello, hello, hello With the lights out, it's less dangerous Here we are now, entertain us I feel stupid and contagious Here we are now, entertain us A mulatto, an albino, a mosquito, my libido Yeah, hey I'm worse at what I do best And for this gift I feel blessed Our little group has always been And always will until the end Hello, hello, hello, how low Hello, hello, hello, how low Hello, hello, hello, how low Hello, hello, hello With the lights out, it's less dangerous Here we are now, entertain us I feel stupid and contagious"
nirvana,"Here we are now, entertain us A mulatto, an albino, a mosquito, my libido Yeah, hey, yeh And I forget just why I taste Oh yeah, I guess it makes me smile I found it hard, it's hard to find Oh well, whatever, never mind Hello, hello, hello, how low Hello, hello, hello, how low Hello, hello, hello, how low Hello, hello, hello With the lights out, it's less dangerous Here we are now, entertain us I feel stupid and contagious Here we are now, entertain us A mulatto, an albino, a mosquito, my libido A denial, a denial, a denial, a denial, a denial A denial, a denial, a denial, a denial What else should I be All apologies What else could I say Everyone is gay What else could I write I don't have the right"
nirvana,"What else should I be All apologies In the sun In the sun I feel as one In the sun In the sun Married Buried I wish I was like you Easily amused Find my nest of salt Everything's my fault I take all the blame Aqua seafoam shame Sunburn, freezer burn Choking on the ashes of her enemy In the sun In the sun I feel as one In the sun In the sun Married Married Married"
nirvana,"Buried Hangin' 'round downtown by myself And I had so much time To sit and think about myself And then there she was Like double cherry pie Yeah, there she was Like disco superfly I smell sex and candy here Who's that lounging in my chair? Who's that casting devious stares in my direction? Mama, this surely is a dream, yeah Yeah mama, this surely is a dream, [dig it] Hangin' 'round downtown by myself And I had too much caffeine And I was thinkin' 'bout myself And then there she was In platform double suede Yeah, there she was Like disco lemonade I smell sex and candy here Who's that lounging in my chair? Who's that casting devious stares in my direction? Mama, this surely is a dream, yeah"
nirvana,"Yeah mama, this surely is a dream, [dig it] Yeah mama, this surely is a dream, yeah Come as you are, as you were As I want you to be As a friend, as a friend As an known enemy Take your time, hurry up The choice is yours, don't be late Take a rest as a friend As an old Memoria, memoria Memoria, memoria Come doused in mud, soaked in bleach As I want you to be As a trend, as a friend As an old Memoria, memoria Memoria, memoria And I swear that I don't have a gun No I don't have a gun No I don't have a gun Memoria, memoria Memoria, memoria (No I don't have a gun) And I swear that I don't have a gun No I don't have a gun No I don't have a gun No I don't have a gun"
nirvana,"No I don't have a gun Memoria, memoria Load up on guns, bring your friends It's fun to lose and to pretend She's over-bored and self-assured Oh no, I know a dirty word Hello, hello, hello, how low Hello, hello, hello, how low Hello, hello, hello, how low Hello, hello, hello With the lights out, it's less dangerous Here we are now, entertain us I feel stupid and contagious Here we are now, entertain us A mulatto, an albino, a mosquito, my libido Yeah, hey I'm worse at what I do best And for this gift I feel blessed Our little group has always been And always will until the end Hello, hello, hello, how low Hello, hello, hello, how low Hello, hello, hello, how low Hello, hello, hello With the lights out, it's less dangerous Here we are now, entertain us I feel stupid and contagious"
nirvana,"Here we are now, entertain us A mulatto, an albino, a mosquito, my libido Yeah, hey, yeh And I forget just why I taste Oh yeah, I guess it makes me smile I found it hard, it's hard to find Oh well, whatever, never mind Hello, hello, hello, how low Hello, hello, hello, how low Hello, hello, hello, how low Hello, hello, hello With the lights out, it's less dangerous Here we are now, entertain us I feel stupid and contagious Here we are now, entertain us A mulatto, an albino, a mosquito, my libido A denial, a denial, a denial, a denial, a denial A denial, a denial, a denial, a denial What else should I be All apologies What else could I say Everyone is gay What else could I write I don't have the right"
nirvana,"What else should I be All apologies In the sun In the sun I feel as one In the sun In the sun Married Buried I wish I was like you Easily amused Find my nest of salt Everything's my fault I take all the blame Aqua seafoam shame Sunburn, freezer burn Choking on the ashes of her enemy In the sun In the sun I feel as one In the sun In the sun Married Married Married"
nirvana,"Buried Hangin' 'round downtown by myself And I had so much time To sit and think about myself And then there she was Like double cherry pie Yeah, there she was Like disco superfly I smell sex and candy here Who's that lounging in my chair? Who's that casting devious stares in my direction? Mama, this surely is a dream, yeah Yeah mama, this surely is a dream, [dig it] Hangin' 'round downtown by myself And I had too much caffeine And I was thinkin' 'bout myself And then there she was In platform double suede Yeah, there she was Like disco lemonade I smell sex and candy here Who's that lounging in my chair? Who's that casting devious stares in my direction? Mama, this surely is a dream, yeah"
nirvana,"Yeah mama, this surely is a dream, [dig it] Yeah mama, this surely is a dream, yeah Come as you are, as you were As I want you to be As a friend, as a friend As an known enemy Take your time, hurry up The choice is yours, don't be late Take a rest as a friend As an old Memoria, memoria Memoria, memoria Come doused in mud, soaked in bleach As I want you to be As a trend, as a friend As an old Memoria, memoria Memoria, memoria And I swear that I don't have a gun No I don't have a gun No I don't have a gun Memoria, memoria Memoria, memoria (No I don't have a gun) And I swear that I don't have a gun No I don't have a gun No I don't have a gun No I don't have a gun"
nirvana,"No I don't have a gun Memoria, memoria She eyes me like a Pisces when I am weak I've been locked inside your heart-shaped box for weeks I've been drawn into your magnetar pit trap trap I wish I could eat your cancer when you turn black Hey! Wait! I've got a new complaint Forever in debt to your priceless advice Hey! Wait! I've got a new complaint Forever in debt to your priceless advice Hey! Wait! I've got a new complaint Forever in debt to your priceless advice, your advice Meat-eating orchids forgive no one just yet Cut myself on angel hair and baby's breath Broken hymen of your Highness, I'm left back Throw down your umbilical noose so I can climb right back Hey! Wait! I've got a new complaint"
nirvana,"Forever in debt to your priceless advice Hey! Wait! I've got a new complaint Forever in debt to your priceless advice Hey! Wait! I've got a new complaint Forever in debt to your priceless advice, your advice She eyes me like a Pisces when I am weak I've been locked inside your heart-shaped box for weeks I've been drawn into your magnetar pit trap trap I wish I could eat your cancer when you turn black Hey! Wait! I've got a new complaint Forever in debt to your priceless advice Hey! Wait! I've got a new complaint Forever in debt to your priceless advice Hey!"
nirvana,"Wait! I've got a new complaint Forever in debt to your priceless advice, your advice, your advice, your advice I'm so happy because today I've found my friends They're in my head I'm so ugly, but that's okay, 'cause so are you We've broken our mirrors Sunday morning is everyday for all I care And I'm not scared Light my candles in a daze 'Cause I've found god Hey, hey, hey I'm so lonely but that's okay I shaved my head And I'm not sad And just maybe I'm to blame for all I've heard But I'm not sure I'm so excited, I can't wait to meet you there But I don't care I'm so horny but that's okay My will is good Hey, hey, hey I like it, I'm not gonna crack"
nirvana,"I miss you, I'm not gonna crack I love you, I'm not gonna crack I killed you, I'm not gonna crack I like it, I'm not gonna crack I miss you, I'm not gonna crack I love you, I'm not gonna crack I killed you, I'm not gonna crack I'm so happy 'cause today I've found my friends, They're in my head I'm so ugly, that's okay, 'cause so are you, Broke our mirrors Sunday morning is everyday for all I care, And I'm not scared Light my candles in a daze 'Cause I've found god Yeah, yeah, Yeah, yeah, Yeah, yeah, Yeah, yeah, Yeah, yeah, Yeah, yeah, yeah I like it, I'm not gonna crack I miss you, I'm not gonna crack"
nirvana,"I love you, I'm not gonna crack I killed you, I'm not gonna crack I like it, I'm not gonna crack I miss you, I'm not gonna crack I love you, I'm not gonna crack I killed you, I'm not gonna crack We passed upon the stair, we spoke of was and when Although I wasn't there, he said I was his friend Which came as some surprise I spoke into his eyes I thought you died alone, a long long time ago Oh no, not me I never lost control You're face to face With the man who sold the world I laughed and shook his hand, and made my way back home I searched for form and land, for years and years I roamed I gazed a gazley stare at all the millions here We must have died along, a long long time ago Who knows? Not me We never lost control You're face to face With the man who sold the world Polly wants a cracker"
nirvana,I think I should get off her first I think she wants some water To put out the blow torch It isn't me We have some seed Let me clip Your dirty wings Let me take a ride Don't cut yourself I want some help To please myself I've got some rope You have been told I promise you I have been true Let me take a ride Don't cut yourself I want some help To please myself Polly wants a cracker Maybe she would like some food She asks me to untie her
nirvana,"A chase would be nice for a few It isn't me We have some seed Let me clip Your dirty wings Let me take a ride Don't cut yourself I want some help To please myself I've got some rope You have been told I promise you I have been true Let me take a ride Don't cut yourself I want some help To please myself Polly said Polly says her back hurts And she's just as bored as me She caught me off my guard It amazes me, the will of instinct It isn't me We have some seed"
nirvana,"Let me clip Your dirty wings Let me take a ride Don't cut yourself I want some help To please myself I've got some rope You have been told I promise you I have been true Let me take a ride Don't cut yourself I want some help To please myself I need an easy friend I do, with an ear to lend I don't think you fit this shoe I do, won't you have a clue I'll take advantage while You hang me out to dry But I can't see you every night Free I'm standing in your line"
nirvana,"I do hope you have the time I do pick a number too I do keep a date with you I'll take advantage while You hang me out to dry But I can't see you every night Free I need an easy friend I do whip her in to land I do think you fit this shoe I do won't you have a clue I'll take advantage while You hang me out to dry But I can't see you every night No I can't see you every night Free I do I do I do I do My girl, my girl, don't lie to me, Tell me where did you sleep last night? In the pines, in the pines Where the sun will never shine I would shiver the whole night through My girl, my girl, where will you go?"
nirvana,"I'm going where the cold wind blows In the pines, in the pines Where the sun will never shine I would shiver the whole night through Her husband, was a hard working man Just about a mile from here His head was found in a driving wheel But his body never was found My girl, my girl, don't lie to me, Tell me where did you sleep last night? In the pines, in the pines Where the sun will never shine I would shiver the whole night through My girl, my girl, where will you go? I'm going where the cold wind blows In the pines, in the pines Where the sun will never shine I would shiver the whole night through Rape me, rape me my friend Rape me, rape me again I'm not the only one I'm not the only one I'm not the only one I'm not the only one Hate me Do it and do it again Waste me Rape me, my friend"
nirvana,"I'm not the only one I'm not the only one I'm not the only one I'm not the only one My favorite inside source I'll kiss your open sores Appreciate your concern You're gonna stink and burn Rape me, rape me my friend Rape me, rape me again I'm not the only one I'm not the only one I'm not the only one I'm not the only one Load up on guns bring your friends It's fun to lose and to pretend She's overbored self assured And all I know are dirty words Hello hello hello how low Hello hello hello how low Hello hello hello how low Hello hello hello how low With,the lights,out it's less dangerous"
nirvana,"Here we are now entertain us I feel stupid and contagious Here we are now entertain us Yeah Yeah Yeah I'm worse at what I do best and for this gift I feel blessed Our little group has always been and always will until the end Hello hello hello how low Hello hello hello how low Hello hello hello how low Hello hello hello how low With,the lights,out it's less dangerous Here we are now entertain us I feel stupid and contagious Here we are now entertain us Yeah Yeah"
nirvana,"Yeah And I forget just why I taste Oh yeah I guess it makes me smile I found it's hard... hard to find Oh well whatever never mind Hello hello hello how low Hello hello hello how low Hello hello hello how low Hello hello hello how low With,the lights,out it's less dangerous Here we are now entertain us I feel stupid and contagious Here we are now entertain us a mullato an albino a denial a denial a denial a denial a denial"
nirvana,"a denial a denial a denial Verse 1: Forward yesterday -- Makes me wanna stay. What they said was real -- Makes me wanna steal. Livin' under house -- Guess I'm livin', I'm a mouse. All's I gots is time -- Got no meaning, just a rhyme. Chorus: Take time with a wounded hand -- Cause it likes to heal Take time with a wounded hand -- Cause I like to steal Take time with a wounded hand -- Cause it likes to heal...I like to steal.. I'm half the man I used to be (This I feel as the dawn, it fades to gray). Well, I'm half the man I used to be (This I feel as the dawn, it fades to gray). Well, I'm half the man I used to be (This I feel as the dawn, it fades to gray). Well, I'm half the man I used to be.. Half the man I used to be.. Verse 2: Feelin' uninspired -- Think I'll start a fire. Everybody run -- Bobby's got a gun."
nirvana,"Think you're kinda neat -- Then she tells me I'm a creep. Friends don't mean a thing -- Guess I'll leave it up to me. Chorus: Take time with a wounded hand -- Cause it likes to heal Take time with a wounded hand -- Cause I like to steal Take time with a wounded hand -- Cause it likes to heal. I like to steal. I'm half the man I used to be (This I feel as the dawn, it fades to gray). Well, I'm half the man I used to be (This I feel as the dawn, it fades to gray). Well, I'm half the man I used to be (This I feel as the dawn, it fades to gray). Well, I'm half the man I used to be.. Half the man I used to be.. Sell the kids for food Weather changes moods Spring is here again Reproductive glands He's the one Who like all our pretty songs And he likes to sing along And he likes to shoot his gun But he don't know what it means"
nirvana,Don't know what it means And I say He's the one Who like all our pretty songs And he likes to sing along And he likes to shoot his gun But he don't know what it means Don't know what it means And I say yeah We can have some more Nature is a whore Bruises on the fruit Tender age in bloom He's the one Who like all our pretty songs And he likes to sing along And he likes to shoot his gun But he don't know what it means Don't know what it means And I say He's the one Who like all our pretty songs
nirvana,"And he likes to sing along And he likes to shoot his gun But he don't know what it means Don't know what it means And I say yeah I'm not like them But I can pretend The sun is gone But I have a light The day is done But I'm having fun I think I'm dumb Or maybe just happy Think I'm just happy My heart is broke But I have some glue Help me inhale And mend it with you We'll float around And hang out on clouds Then we'll come down And have a hangover, have a hangover Skin the sun"
nirvana,"Fall asleep Wish away The soul is cheap Lesson learned Wish me luck Soothe the burn Wake me up I'm not like them But I can pretend The sun is gone But I have a light The day is done But I'm having fun My girl, my girl, don't lie to me Tell me where did you sleep last night In the pines, in the pines Where the sun don't ever shine I would shiver the whole night through My girl, my girl, where will you go I'm going where the cold wind blows In the pines, in the pines Where the sun don't ever shine I would shiver the whole night through Her husband, was a hard working man"
nirvana,"Just about a mile from here His head was found in a driving wheel But his body never was found My girl, my girl, don't lie to me Tell me where did you sleep last night In the pines, in the pines Where the sun don't ever shine I would shiver the whole night through My girl, my girl, where will you go I'm going where the cold wind blows In the pines, in the pines Where the sun don't ever shine I would shiver the whole night through My girl, my girl, don't lie to me Tell me where did you sleep last night In the pines, in the pines Where the sun don't ever shine I would shiver the whole night through My girl, my girl, where will you go I'm going where the cold wind blows In the pines, in the pines The sun, shine I would shiver the whole night through One baby to another says, ""I'm lucky to have met you"" I don't care what you think unless it is about me"
nirvana,"It is now my duty to completely drain you I travel through a tube and end up in your infection Chew my meat for you Pass it back and forth in a passionate kiss From my mouth to yours I like you With eyes so dilated, I've became your pupil You've taught me everything without a poison apple The water is so yellow I'm a healthy student Indebted and so grateful Vacuum out the fluids Chew my meat for you Pass it back and forth in a passionate kiss From my mouth to yours I like you, you, you, you, you, you One baby to another says, ""I'm lucky to have met you"" I don't care what you think unless it is about me It is now my duty to completely drain you A travel through a tube and end up in your infection Chew my meat for you Pass it back and forth in a passionate kiss"
nirvana,"From my mouth to yours Sloppy lips to lips You're my vitamins I like you Somebody finally freed my brother One more day to free my brother Help me I won't find a way, no I'm going there to free my brother No one there to free my brother (Don't go there to free my brother?) Help me I won't find a way, brother He's the friend to revive With all the love I got In every way I love you (In every way I'll help you?) Help me know Going my way Jesus, don't want me for a sunbeam Sunbeams are never made like me Don't expect me to cry, For all the reasons you had to die Don't ever ask your love of me Don't expect me to cry Don't expect me to lie Don't expect me to die for me Jesus, don't want me for a sunbeam Sunbeams are never made like me Don't expect me to cry, For all the reasons you had to die Don't ever ask your love of me Don't expect me to cry Don't expect me to lie"
nirvana,"Don't expect me to die for me Don't expect me to cry Don't expect me to lie Don't expect me to die for me Jesus, don't want me for a sunbeam Sunbeams are never made like me Don't expect me to cry, For all the reasons you had to die Don't ever ask your love of me Don't expect me to cry Don't expect me to lie Don't expect me to die Don't expect me to cry Don't expect me to lie Don't expect me to die for me I would never bother you I would never promise to I will never follow you I will never bother you Never say a word again I will crawl away for good I will move away from here You won't be afraid of fear No thought was put into this I always knew it would come to this"
nirvana,Things have never been so swell And I have never failed to fail Pain Pain Pain You know you're right You know you're right You know you're right It's so warm and calm inside I no longer have to hide There's talk about someone else Sterling silver begins to melt Nothin' really bothers her She just wants to love herself I will move away from here You won't be afraid of fear No thought was put into this I always knew it'd come to this Things have never been so swell And I have never failed to fail Pain Pain Pain Pain
nirvana,Pain You know you're right You know you're right You know you're right You know you're right You know you're right You know you're right You know you're right You know you're right You know you're right You know you're right You know you're right You know you're right You know your rights You know your rights You know your rights Pain Underneath the bridge The tarp has sprung a leak And the animals I've trapped Have all become my pets
nirvana,"And I'm living off of grass And the drippings from the ceiling But it's okay to eat fish 'Cause they don't have any feelings Something in the way Ummmmm Something in the way, yeah Ummmmm Something in the way Ummmmm Something in the way, yeah Ummmmm Something in the way Ummmmm Something in the way, yeah Ummmmm Underneath the bridge The tarp has sprung a leak And the animals I've trapped Have all become my pets And I'm living off of grass And the drippings from the ceiling"
nirvana,"But it's okay to eat fish 'Cause they don't have any feelings Something in the way Ummmmm Something in the way, yeah Ummmmm Something in the way Ummmmm Something in the way, yeah Ummmmm Something in the way Ummmmm Something in the way, yeah Ummmmm Something in the way Ummmmm Something in the way, yeah Ummmmm I don't care I don't care I don't care I don't care"
nirvana,"I don't care Care if it's old I don't mind I don't mind I don't mind I don't mind I don't mind Mind, don't have a mind Get away Get away Get away Get away Away, away from your home I'm afraid I'm afraid I'm afraid I'm afraid I'm afraid Afraid, afraid of a ghost Even if you have Even if you need I don't mean to stare We don't have to breed We could plant a house"
nirvana,"We could build a tree I don't even care We could have all three She said She said She said She said She said She said She said I don't care I don't care I don't care I don't care I don't care Care if it's old I don't mind I don't mind I don't mind I don't mind I don't mind Mind, I don't have a mind Get away"
nirvana,"Get away Get away Get away Away, away from your home I'm afraid I'm afraid I'm afraid I'm afraid I'm afraid Afraid, afraid of a ghost Even if you have Even if you need I don't mean to stare We don't have to breed We can plant a house We can build a tree I don't even care We could have all three She said She said She said She said"
nirvana,"She said She said She said She said Even if you have Even if you need I don't mean to stare We don't have to breed We can plant a house We can build a tree I don't even care We could have all three She said She said She said She said She said She said She said She said, good! Where do bad folks go when they die? They don't go to heaven where the angels fly"
nirvana,They go down to the lake of fire and fry Won't see 'em again till the fourth of July I knew a lady who came from Duluth She got bit by a dog with a rabid tooth She went to her grave just a little too soon And she flew away howling on the yellow moon Where do bad folks go when they die? They don't go to heaven where the angels fly They go down to the lake of fire and fry Won't see 'em again till the fourth of July Now the people cry and the people moan And they look for a dry place to call their home And try to find some place to rest their bones While the angels and the devils Fight to claim them for their own Wouldn't you believe it It's just my luck Wouldn't you believe it It's just my luck Wouldn't you believe it It's just my luck Wouldn't you believe it It's just my luck No recess No recess
nirvana,No recess Wouldn't you believe it It's just my luck Wouldn't you believe it It's just my luck Wouldn't you believe it It's just my luck Wouldn't you believe it It's just my luck No recess No recess No recess You're in high school again You're in high school again You're in high school again You're in high school again You're in high school again You're in high school again You're in high school again You're in high school again No recess No recess No recess No recess No recess No recess
